{
  "materials": [
    {"name": "Luft", "depletion_rate": 1.7},
    {"name": "Vand", "depletion_rate": 1.7},
    {"name": "Mad", "depletion_rate": 1.7}
  ],
  "practiceRun": false,
  "soundVolume": 0,
  "shuffleParticipants": true,
  "roundLengthInSeconds":  600,
  "inventoryBonusLimit": 600,
  "inventoryCriticalLimit": 100,
  "chat": "free",
  "allowDirectMessages": true,
  "tooltip": ["inventories", "specializations"],
  "trade_delay": 0,
  "players": [
    {
      "name": "Elysium",
      "inventory": [
        {"name": "Luft", "amount": 1000},
        {"name": "Vand", "amount": 1000},
        {"name": "Mad", "amount": 1000}
      ],
      "specializations": [{
        "input": "Luft",
        "output": "Vand",
        "gain": 2,
      	"production_delay": 10
      }]
    },
    {
      "name": "Utopia",
      "inventory": [
        {"name": "Luft", "amount": 1000},
        {"name": "Vand", "amount": 1000},
        {"name": "Mad", "amount": 1000}
      ],
      "specializations": [{
        "input": "Vand",
        "output": "Mad",
        "gain": 2,
	      "production_delay": 10
      }]
    },
    {
      "name": "Isidis",
      "inventory": [
        {"name": "Luft", "amount": 1000},
        {"name": "Vand", "amount": 1000},
        {"name": "Mad", "amount": 1000}
      ],
      "specializations": [{
        "input": "Mad",
        "output": "Luft",
        "gain": 2,
	      "production_delay": 10
      }]
    }
  ]
}
