{
  "materials": [
    {"name": "Palladium", "depletion_rate": 1.111111111},
    {"name": "Selenium", "depletion_rate": 1.111111111},
    {"name": "Tungsten", "depletion_rate": 1.111111111}
  ],
  "practiceRun": true,
  "soundVolume": 0,
  "shuffleParticipants": true,
  "roundLengthInSeconds":  600,
  "inventoryBonusLimit": 600,
  "inventoryCriticalLimit": 100,
  "chat": "free",
  "allowDirectMessages": true,
  "tooltip": ["inventories", "specializations"],
  "trade_delay": 0,
  "players": [
    {
      "name": "Oceania Colony",
      "inventory": [
        {"name": "Palladium", "amount": 1000},
        {"name": "Selenium", "amount": 1000},
        {"name": "Tungsten", "amount": 1000}
      ],
      "specializations": [{
        "input": "Palladium",
        "output": "Selenium",
        "gain": 4,
      	"production_delay": 10
      }]
    },
    {
      "name": "Eurasia Colony",
      "inventory": [
        {"name": "Palladium", "amount": 1000},
        {"name": "Selenium", "amount": 1000},
        {"name": "Tungsten", "amount": 1000}
      ],
      "specializations": [{
        "input": "Selenium",
        "output": "Tungsten",
        "gain": 4,
	      "production_delay": 10
      }]
    },
    {
      "name": "Eastasia Colony",
      "inventory": [
        {"name": "Palladium", "amount": 1000},
        {"name": "Selenium", "amount": 1000},
        {"name": "Tungsten", "amount": 1000}
      ],
      "specializations": [{
        "input": "Tungsten",
        "output": "Palladium",
        "gain": 4,
	      "production_delay": 10
      }]
    },
    {
      "name": "Africa Colony",
      "inventory": [
        {"name": "Palladium", "amount": 1000},
        {"name": "Selenium", "amount": 1000},
        {"name": "Tungsten", "amount": 1000}
      ],
      "specializations": [{
        "input": "Palladium",
        "output": "Selenium",
        "gain": 4,
      	"production_delay": 10
      }]
    },
    {
      "name": "South America Colony",
      "inventory": [
        {"name": "Palladium", "amount": 1000},
        {"name": "Selenium", "amount": 1000},
        {"name": "Tungsten", "amount": 1000}
      ],
      "specializations": [{
        "input": "Selenium",
        "output": "Tungsten",
        "gain": 4,
	      "production_delay": 10
      }]
    },
    {
      "name": "North America Colony",
      "inventory": [
        {"name": "Palladium", "amount": 1000},
        {"name": "Selenium", "amount": 1000},
        {"name": "Tungsten", "amount": 1000}
      ],
      "specializations": [{
        "input": "Tungsten",
        "output": "Palladium",
        "gain": 4,
	      "production_delay": 10
      }]
    }
  ]
}
