{
  "materials": [
    {"name": "Palladium", "depletion_rate": 0},
    {"name": "Selenium", "depletion_rate": 0},
    {"name": "Tungsten", "depletion_rate": 0}
  ],
  "practiceRun": true,
  "soundVolume": 0,
  "shuffleParticipants": true,
  "roundLengthInSeconds":  600,
  "inventoryBonusLimit": 600,
  "inventoryCriticalLimit": 100,
  "chat": "free",
  "allowDirectMessages": true,
  "tooltip": ["inventories", "specializations"],
  "trade_delay": 0,
  "players": [
    {
      "name": "Oceania",
      "inventory": [
        {"name": "Palladium", "amount": 1000},
        {"name": "Selenium", "amount": 1000},
        {"name": "Tungsten", "amount": 1000}
      ],
      "specializations": [{
        "input": "Palladium",
        "output": "Selenium",
        "gain": 1.5,
      	"production_delay": 10
      }]
    },
    {
      "name": "Eurasia",
      "inventory": [
        {"name": "Palladium", "amount": 1000},
        {"name": "Selenium", "amount": 1000},
        {"name": "Tungsten", "amount": 1000}
      ],
      "specializations": [{
        "input": "Selenium",
        "output": "Tungsten",
        "gain": 1.5,
	      "production_delay": 10
      }]
    },
    {
      "name": "Eastasia",
      "inventory": [
        {"name": "Palladium", "amount": 1000},
        {"name": "Selenium", "amount": 1000},
        {"name": "Tungsten", "amount": 1000}
      ],
      "specializations": [{
        "input": "Tungsten",
        "output": "Palladium",
        "gain": 1.5,
	      "production_delay": 10
      }]
    },
    {
      "name": "Africa",
      "inventory": [
        {"name": "Palladium", "amount": 1000},
        {"name": "Selenium", "amount": 1000},
        {"name": "Tungsten", "amount": 1000}
      ],
      "specializations": [{
        "input": "Palladium",
        "output": "Selenium",
        "gain": 1.5,
      	"production_delay": 10
      }]
    },
    {
      "name": "South America",
      "inventory": [
        {"name": "Palladium", "amount": 1000},
        {"name": "Selenium", "amount": 1000},
        {"name": "Tungsten", "amount": 1000}
      ],
      "specializations": [{
        "input": "Selenium",
        "output": "Tungsten",
        "gain": 1.5,
	      "production_delay": 10
      }]
    },
    {
      "name": "North America",
      "inventory": [
        {"name": "Palladium", "amount": 1000},
        {"name": "Selenium", "amount": 1000},
        {"name": "Tungsten", "amount": 1000}
      ],
      "specializations": [{
        "input": "Tungsten",
        "output": "Palladium",
        "gain": 1.5,
	      "production_delay": 10
      }]
    }
  ]
}
